#,Song,Artist,BPM,Camelot,Energy,Added At,Duration,Popularity,Genres,Album,Album Date,Dance,Acoustic,Instrumental,Valence,Speech,Live,Loud (Db),Key,Time Signature,Spotify Track Id,ISRC,Explicit
1,"Cause We've Ended as Lovers","Jeff Beck",115,5A,29,2024-06-11,05:41,57,"jazz fusion, blues rock, blues","Blow By Blow",1975-03-29,55,14,80,14,0,10,-13,C Minor,4,4zoQ3EqopTIGmK2c2rPV5t,USSM19906464,no
2,"Free Bird","Lynyrd Skynyrd",118,8B,83,2024-06-11,09:07,84,"southern rock, classic rock, rock","Pronounced' Leh-'Nerd 'Skin-'Nerd",1973-01-01,25,7,0,34,0,0,-8,C Major,4,5EWPGh7jbTNO2wakv8LjUI,USMC17301722,no
3,"Eruption - 2015 Remaster","Van Halen",94,4B,69,2024-06-11,01:42,64,"glam metal, classic rock, rock, hard rock","Van Halen (Remastered)",1978-02-10,23,47,81,50,0,30,-9,G#/A♭ Major,4,2tAeN2TKlQLOoSPXtARzBV,USWB11403669,no
4,"Reelin' In The Years","Steely Dan",135,10B,54,2024-06-11,04:37,78,"yacht rock, classic rock","Can't Buy A Thrill",1972-11-01,49,15,0,72,0,0,-17,D Major,4,1x1XQqhBViz4opcpwc7FVs,USMC17347184,no
5,"Alive","Pearl Jam",75,10A,88,2024-06-11,05:40,79,"grunge, rock, post-grunge","Ten",1991-08-27,28,1,0,60,0,40,-6,B Minor,4,1L94M3KIu7QluZe63g64rv,USSM19100003,no
6,"Bohemian Rhapsody","Queen",144,5A,39,2024-06-11,05:55,4,"classic rock, rock, glam rock","Stone Cold Classics",2006-01-01,40,27,0,21,0,10,-10,C Minor,4,6l8GvAyoUZwWDgF1e4822w,GBCEE0500364,no
7,"Sympathy For The Devil","The Rolling Stones",116,11B,68,2024-06-11,06:16,66,"classic rock, rock","The Rolling Stones Singles Collection: The London Years",1989-08-15,73,61,0,58,20,0,-11,A Major,4,75zMKn5euxQdlkZgu4P42J,USA176810010,no
8,"Crazy Train","Ozzy Osbourne",138,11B,91,2024-06-11,04:53,84,"metal, glam metal, heavy metal, hard rock","Blizzard Of Ozz (40th Anniversary Expanded Edition)",2020-09-18,45,41,0,52,10,20,-4,A Major,4,7ACxUo21jtTHzy7ZEV56vU,USSM11002845,no
9,"All Along the Watchtower","Jimi Hendrix",113,4B,81,2024-06-11,04:00,78,"psychedelic rock, classic rock, acid rock, blues rock","Electric Ladyland",1968-10-25,44,0,0,56,0,0,-6,G#/A♭ Major,4,2aoo2jlRnM3A0NyLQqMN2f,USQX90900749,no
10,"Hotel California - 2013 Remaster","Eagles",147,10B,51,2024-06-11,06:31,89,"classic rock, yacht rock, soft rock","Hotel California (2013 Remaster)",1976-12-08,58,1,0,61,0,0,-9,D Major,4,40riOy7x9W7GXjyGp4pjAv,USEE11300353,no
11,"Comfortably Numb","Pink Floyd",127,10A,37,2024-06-11,06:22,82,"progressive rock, psychedelic rock, classic rock, art rock, rock","The Wall",1979-11-30,47,15,31,17,0,0,-13,B Minor,4,5HNCy40Ni5BZJFw1TKzRsC,GBN9Y1100113,no
12,"Sunshine Of Your Love","Cream",115,10B,59,2024-06-11,04:10,74,"classic rock, psychedelic rock, acid rock, blues rock","Disraeli Gears (Deluxe Edition)",1967-11,68,39,0,73,0,10,-8,D Major,4,2K2M0TcglCRLLpFOzKeFZA,GBA076700020,no
13,"Sweet Child O' Mine","Guns N' Roses",125,2B,95,2024-06-11,05:56,91,"rock, glam metal, hard rock, classic rock","Appetite For Destruction",1987-07-21,45,9,8,62,0,10,-5,F#/G♭ Major,4,7snQQk1zcKl8gZ92AnueZW,USGF18714809,no
14,"Stairway to Heaven - Remaster","Led Zeppelin",82,8A,34,2024-06-11,08:02,84,"classic rock, rock, hard rock, rock and roll","Led Zeppelin IV (Deluxe Edition)",1971-11-08,34,58,0,20,0,10,-12,A Minor,4,5CQ30WqJwcep0pYcV4AMNc,USAT21300959,no
15,"Jessica","Allman Brothers Band",105,10B,75,2024-06-11,07:30,52,"southern rock, jam band, classic rock, blues rock, country rock","Dreams",1989-06-20,35,37,74,88,0,10,-11,D Major,4,2tVQhBSJ1SQtb4gX0taaiR,USPG19190006,no
16,"25 or 6 to 4 - 2002 Remaster","Chicago",147,9A,91,2024-06-11,04:49,69,"yacht rock, soft rock","Chicago II",1970-01-26,60,31,6,72,0,0,-7,E Minor,4,7GqIDx2QVGOpd4r1fZaUUW,USRH10285518,no
17,"Stranglehold","Ted Nugent",148,10B,74,2024-06-11,08:22,53,"classic rock, acid rock, southern rock","Great Gonzos! The Best Of Ted Nugent",1981-00-00,49,2,17,51,0,20,-7,D Major,4,7itr4N5bXkAWesPUomCNf7,USSM19804011,no
18,"While My Guitar Gently Weeps - Remastered 2009","The Beatles",115,9A,65,2024-06-11,04:45,75,"classic rock, psychedelic rock","The Beatles (Remastered)",1968-11-22,45,2,0,70,0,10,-9,E Minor,4,389QX9Q1eUOEZ19vtzzI9O,GBAYE0601650,no
19,"Purple Rain","Prince",113,6B,45,2024-06-11,08:40,8,"funk rock, funk","Purple Rain",1984-06-25,37,4,0,19,0,60,-10,A#/B♭ Major,4,54X78diSLoUDI3joC2bjMz,USWB10001880,no
20,"Little Wing","Stevie Ray Vaughan",115,3B,38,2024-06-11,06:48,63,"blues, blues rock, classic blues, southern rock, modern blues","Couldn't Stand The Weather (Legacy Edition)",1984-00-00,48,36,75,52,0,0,-14,C♯/D♭ Major,4,5XNpdKmlLJPUbwKQceX2tW,USSM19932782,no
21,"Sultans of Swing","Dire Straits",148,7B,80,2024-06-11,05:48,78,"classic rock","Dire Straits",1978-10-07,73,7,3,93,0,30,-10,F Major,4,6cr6UDpkjEaMQ80OjWqEBQ,GBF089601041,no
22,"Voodoo Child (Slight Return)","Jimi Hendrix",176,4B,91,2024-06-11,05:13,69,"psychedelic rock, classic rock, acid rock, blues rock","Electric Ladyland",1968-10-25,21,48,1,45,30,0,-7,G#/A♭ Major,4,2AxCeJ6PSsBYiTckM0HLY7,USQX90900750,no
23,"November Rain","Guns N' Roses",80,1B,64,2024-06-11,08:56,86,"rock, glam metal, hard rock, classic rock","Use Your Illusion I",1991-09-17,29,2,22,23,0,10,-9,B Major,4,3YRCqOhFifThpSRFJ1VWFM,USGF19141510,no
24,"Hot for Teacher - 2015 Remaster","Van Halen",128,10B,95,2024-06-11,04:42,71,"glam metal, classic rock, rock, hard rock","1984 (Remastered)",1984-01-04,55,0,0,47,10,0,-5,D Major,4,6QDbGdbJ57Mtkflsg42WV5,USWB11403684,no
25,"Back In Black","AC/DC",188,11B,70,2024-06-11,04:16,88,"rock, hard rock, classic rock, rock and roll","Back In Black",1980-07-25,31,1,1,76,0,0,-6,A Major,4,08mG3Y1vljYA6bvDt4Wqkj,AUAP08000046,no
26,"Fade To Black (Remastered)","Metallica",113,9B,93,2024-06-11,06:57,68,"metal, thrash metal, rock, heavy metal, hard rock","Ride The Lightning (Deluxe Remaster)",1984-07-27,26,0,20,28,10,10,-7,G Major,4,0dqGfCMAGyDgpUAgLNOjWd,USEE10170110,no
27,"Aqualung","Jethro Tull",123,6A,48,2024-06-11,06:36,60,"progressive rock, classic rock, art rock","Aqualung (Special Edition)",1971-03-19,48,6,3,66,0,0,-12,G Minor,4,5UuikgHTxSRFRnC0zXx10i,GBAYK7100012,no
28,"Heartbreaker - 1990 Remaster","Led Zeppelin",97,11B,71,2024-06-11,04:14,69,"classic rock, rock, hard rock, rock and roll","Led Zeppelin II (1994 Remaster)",1969-10-22,40,7,49,65,0,10,-9,A Major,4,6WE7jSshLCuVKoCmobVKVf,USAT29900475,no
29,"Paranoid","Black Sabbath",163,9A,63,2024-06-11,02:47,58,"metal, heavy metal, rock, stoner rock, doom metal, hard rock","The Ultimate Collection",2017-02-03,43,0,0,38,0,10,-12,E Minor,4,4MSqgoFS7e8LpsxeeMMVMu,GBAJE7000057,no
30,"Crossroads - Live","Cream",132,9B,76,2024-06-11,04:18,60,"classic rock, psychedelic rock, acid rock, blues rock","Wheels Of Fire",1968-07-01,39,41,4,84,0,80,-11,G Major,4,6PUabSMXmPnZna361Wwmf7,GBA076800010,no
31,"Cliffs Of Dover - Instrumental","Eric Johnson",95,9B,78,2024-06-11,04:09,60,"","Ah Via Musicom",1990-00-00,45,16,15,31,0,20,-12,G Major,4,5qm0KiVKMXW1kq6VrnIhz5,USCA28900086,no
32,"Lenny","Stevie Ray Vaughan",118,4B,17,2024-06-11,04:57,57,"blues, blues rock, classic blues, southern rock, modern blues","Texas Flood (Legacy Edition)",1983-00-00,51,78,46,32,0,10,-18,G#/A♭ Major,4,0h4jHdNzUrV9eGR2PT5R8c,USSM18300426,no
33,"Shine On You Crazy Diamond (Pts. 1-5)","Pink Floyd",138,6A,29,2024-06-11,13:32,75,"progressive rock, psychedelic rock, classic rock, art rock, rock","Wish You Were Here",1975-09-12,26,77,69,4,0,10,-12,G Minor,3,6pnwfWyaWjQiHCKTiZLItr,GBN9Y1100085,no
34,"Highway Star","Deep Purple",174,8A,90,2024-06-11,06:08,63,"hard rock, classic rock, rock","Machine Head",1972-03-25,30,3,1,54,0,30,-8,A Minor,4,4gVTozEmzwAUXpwj3jEetX,USWB19901165,no
35,"Bold as Love","Jimi Hendrix",142,3B,74,2024-06-11,04:11,57,"psychedelic rock, classic rock, acid rock, blues rock","Axis: Bold As Love",1967-12-01,35,2,1,60,0,0,-6,C♯/D♭ Major,4,0uco0wQkB909zpPlHvu5Cc,USQX90900764,no
36,"Hitch a Ride","Boston",116,5B,81,2024-06-11,04:11,59,"classic rock, aor","Boston",1976-00-00,38,0,0,57,0,10,-7,D#/E♭ Major,4,0870QNicMawQH2cnzBVZ3P,USSM17600648,no
37,"Brighton Rock - Remastered 2011","Queen",138,10A,84,2024-06-11,05:10,45,"classic rock, rock, glam rock","Sheer Heart Attack (Deluxe Remastered Version)",1974-11-08,35,36,1,35,30,70,-9,B Minor,4,4ObxJP7kYUkBqpiklCzrBo,GBUM71100517,no
38,"Statesboro Blues - Live At Fillmore East, March 12, 1971 - First Show","Allman Brothers Band",127,10B,68,2024-06-11,04:44,44,"southern rock, jam band, classic rock, blues rock, country rock","The 1971 Fillmore East Recordings",1971-07,48,14,1,66,0,80,-9,D Major,4,3UsbGR71AjcBYOWoUlfTdm,USUM71403681,no
39,"Still Got The Blues","Gary Moore",170,8A,39,2024-06-11,06:10,72,"blues, blues rock","Still Got The Blues",1990-01-01,19,26,0,32,0,10,-14,A Minor,3,0DnGfA1r8pAssJCuq4ojla,GBAAA9000090,no
40,"Surfing with the Alien","Joe Satriani",167,7B,94,2024-06-11,04:24,54,"","Surfing With The Alien",1987-00-00,39,0,84,56,0,40,-7,F Major,4,2ekfM9Dcslm7l9Lh7HGT0i,USSM18700084,no
41,"Maggot Brain","Funkadelic",131,9A,37,2024-06-11,10:19,60,"funk, funk rock, psychedelic rock","Maggot Brain",1971-07-12,31,50,72,13,0,60,-15,E Minor,3,5WJU527RQNyMLuKecjsL8V,US25X0588947,yes
42,"Floods","Pantera",121,1B,81,2024-06-11,06:59,72,"groove metal, metal, thrash metal, heavy metal","The Great Southern Trendkill",1996-05-03,36,0,1,15,0,10,-7,B Major,4,1L2ZkXbRX00ZiaUDuMMgf7,USEW29600009,yes
43,"For the Love of God","Steve Vai",95,8A,84,2024-06-11,06:03,55,"","Passion And Warfare",1990-07,15,0,91,28,0,10,-6,A Minor,4,5m5I3KcV83zf2p2qbsnr3y,USSM19000148,no
44,"La Villa Strangiato","Rush",143,8B,61,2024-06-11,09:34,56,"progressive rock, classic rock, hard rock, rock, aor","Hemispheres",1978-10-29,37,0,58,14,0,0,-10,C Major,4,4CyElmiM9EF9aURGWlPZLi,USMR17880086,no
45,"Europa (Earth's Cry Heaven's Smile)","Santana",75,5A,67,2024-06-11,05:05,57,"","Ultimate Santana",2007-09-25,30,3,83,68,0,10,-5,C Minor,4,5Yp3e8RcjYevBTZYJ7OD7s,USSM10013400,no
46,"Watermelon In Easter Hay","Frank Zappa",111,11B,43,2024-06-11,09:07,0,"progressive rock, psychedelic rock, art rock, jazz fusion, avant-garde, experimental","Joe's Garage Acts I, II & III",1979-09-17,49,19,3,30,0,10,-13,A Major,4,0Q2dRzhPWFOex89dOjbq5Y,USZPE1200277,no
47,"I'm the One - 2015 Remaster","Van Halen",114,3B,98,2024-06-11,03:44,56,"glam metal, classic rock, rock, hard rock","Van Halen (Remastered)",1978-02-10,31,2,0,24,20,10,-6,C♯/D♭ Major,4,2xS1lC45sjj60M1eeRsOUp,USWB11403672,no
48,"Shock Me","KISS",127,3B,81,2024-06-11,03:46,49,"glam rock, glam metal, hard rock, rock, classic rock","Love Gun",1977-06-30,66,4,0,87,0,0,-8,C♯/D♭ Major,4,39hfj6Tnqgsxn7jGTfWl18,USPR37730030,no
49,"The Width of a Circle - 2015 Remaster","David Bowie",134,11B,43,2024-06-11,08:12,45,"glam rock, art rock","The Man Who Sold the World (2015 Remaster)",1970-11-04,38,1,2,18,0,20,-14,A Major,4,2o9VAWKD7yvnyrBRw9tzgH,USJT11500092,no
50,"Flying in a Blue Dream","Joe Satriani",127,8B,78,2024-06-11,05:21,50,"","Flying In A Blue Dream",1989-10-30,50,5,81,8,0,10,-5,C Major,4,2NrqjA3YUfNuZcmQzE2EJe,USSM18900123,no
51,"One Bourbon, One Scotch, One Beer","George Thorogood & The Destroyers",137,11B,64,2024-07-17,08:26,65,"classic rock, blues rock, southern rock","George Thorogood & the Destroyers",1977-00-00,55,14,0,76,10,0,-15,A Major,4,0s995gCthqnYJCWGvfKpNt,USRO27701303,no
52,"Immigrant Song - Remaster","Led Zeppelin",113,1B,93,2025-11-29,02:26,82,"classic rock, rock, hard rock, rock and roll","Led Zeppelin III (Remaster)",1970-00-00,56,1,17,62,0,30,-10,B Major,4,78lgmZwycJ3nzsdgmPPGNx,USAT21300934,no