#,Song,Artist,BPM,Camelot,Energy,Added At,Duration,Popularity,Genres,Album,Album Date,Dance,Acoustic,Instrumental,Valence,Speech,Live,Loud (Db),Key,Time Signature,Spotify Track Id,ISRC,Explicit
1,"Lunatic Fringe","Corey Taylor",90,3A,34,2024-06-11,04:07,38,"","CMFB …Sides",2022-02-25,72,71,0,39,0,10,-9,A#/B♭ Minor,4,5iRYVhTzQLxcrH7gthRJ8t,NLA322100326,no
2,"Burning Down the House","Paramore",106,8B,77,2024-06-11,03:38,58,"pop punk, emo","Burning Down the House",2024-01-31,74,2,1,39,0,10,-6,C Major,4,3pRCHHfwYNVCOjWSrkGNw1,QMB622402601,no
3,"Zombie (Live from the NIVA Save Our Stages Festival)","Miley Cyrus",164,9B,87,2024-06-11,04:50,60,"","Plastic Hearts",2020-11-27,41,0,5,32,0,10,-5,G Major,4,0olaaJrCBTMJJvqPdvNpsx,USRC12003766,no
4,"Rolling In The Deep - Recorded At Spotify Studios NYC","Greta Van Fleet",105,10A,47,2024-06-11,03:57,59,"rock","Spotify Singles",2018-01-24,61,1,0,39,0,10,-10,B Minor,4,2VprRdTmbgyjXnDzHIcfNl,USUM71714153,no
5,"The Sound of Silence","Disturbed",86,11A,28,2024-06-11,04:08,79,"metal, nu metal, alternative metal, rap metal, hard rock","Immortalized",2015-08-14,32,47,0,18,0,10,-9,F#/G♭ Minor,4,1Cj2vqUwlJVG27gJrun92y,USRE11500180,no
6,"Africa","Weezer",92,4B,78,2024-06-11,03:58,59,"alternative rock","Weezer (Teal Album)",2019-01-24,53,21,1,60,0,10,-4,G#/A♭ Major,4,3ZPKocroJIcnHGcnJVlLKD,USAT21802455,no
7,"All Along the Watchtower","Jimi Hendrix",113,4B,81,2024-06-11,03:58,57,"psychedelic rock, classic rock, acid rock, blues rock","Experience Hendrix: The Best Of Jimi Hendrix",1997-09-16,43,0,0,63,0,0,-6,G#/A♭ Major,4,7xdLNxZCtY68x5MAOBEmBq,USQX90900749,no
8,"Turn The Page","Metallica",149,4B,82,2024-06-11,06:06,66,"metal, thrash metal, rock, heavy metal, hard rock","Garage, Inc.",1998-11-24,42,0,1,23,0,0,-4,G#/A♭ Major,4,7HPhrbgMHV5cUskknWA2oo,USEV19800008,no
9,"Nothing Else Matters","Miley Cyrus,WATT,Elton John,Yo-Yo Ma,Robert Trujillo,Chad Smith",143,9A,67,2024-06-11,06:35,51,"classical, chamber music, rap metal, rap rock","Nothing Else Matters",2021-06-22,45,1,0,14,0,10,-5,E Minor,3,43YC4iYmSsYueViJR4dBGA,QMKHM2100037,no
10,"Somebody That I Used to Know","Three Days Grace",120,10A,64,2024-06-11,03:29,59,"post-grunge, rock","Somebody That I Used to Know",2020-07-22,60,0,0,51,0,20,-8,B Minor,4,100lHmeZbp3OvinYgotmVc,USRC12002108,no
11,"Royals","The Struts",170,9B,95,2024-06-11,03:36,0,"glam rock","Royals",2023-08-18,25,10,0,33,0,10,-4,G Major,4,2kRzQJ6CBubjaLBbDIuLra,QZRD92303605,no
12,"Papa Was A Rolling Stone feat. Demi Lovato","Slash,Demi Lovato",118,4B,77,2024-06-11,07:52,37,"hard rock, ","Orgy of the Damned",2024-05-17,63,1,0,71,0,10,-8,G#/A♭ Major,4,6CrfUWMJeXpdFQQdew5OBf,QZWH32400011,no
13,"99 Red Balloons","Goldfinger",97,12B,84,2024-06-11,04:02,40,"ska punk, ska, skate punk, punk, pop punk","Music From The Motion Picture Not Another Teen Movie",2001-04-01,30,0,0,24,10,30,-5,E Major,4,4iHITBaV9sOIukW5ABdHhI,USUR19980545,no
14,"Billie Jean","Chris Cornell",138,9A,63,2024-06-11,04:41,51,"grunge","Carry On",2007-05-28,51,59,0,41,0,10,-5,E Minor,3,7sZD8tOmfRUObogGX8VzfZ,USUM70730465,no
15,"Separate Ways (Worlds Apart)","Daughtry,Lzzy Hale",131,10B,89,2024-06-11,05:16,62,"post-grunge, ","Separate Ways (Worlds Apart)",2023-01-05,40,0,0,9,0,70,-4,D Major,4,7goFhrbCC2m2HI3EbBYgU4,US39N2204912,no
16,"Simple Man - Rock Version","Shinedown",121,9B,63,2024-06-11,04:25,66,"post-grunge, alternative metal, rock","Leave a Whisper (Deluxe Edition)",2003-07-15,53,6,0,23,0,20,-5,G Major,4,6WXdlIUbsqFSS6T63eCBxx,USAT20901112,no
17,"Simple Man - Acoustic","Shinedown",121,9B,37,2024-06-11,05:20,63,"post-grunge, alternative metal, rock","Leave a Whisper (Deluxe Edition)",2003-07-15,57,77,0,41,0,20,-8,G Major,4,4VuKGQiCzE5BdSdvp6Hjoh,USAT20400312,no
18,"Baba O'Riley","The Ghost of Paul Revere",81,1B,44,2025-10-19,04:46,39,"bluegrass, folk","Field Notes, Vol. 1",2015-12-11,34,10,1,25,0,10,-9,B Major,4,514IfPgRwyDgjFtLBI0DMP,USZAT1571984,no
19,"Lavender Haze","Strutman Lane",112,4B,72,2025-10-21,03:46,41,"","Lavender Haze",2024-01-21,72,5,0,91,0,10,-5,G#/A♭ Major,4,13hpAXFkVqLaLU7YZH8NvI,QZWFN2393819,yes
20,"Patience","Chris Cornell",127,11A,65,2025-10-21,04:13,61,"grunge","No One Sings Like You Anymore",2020-12-11,60,28,0,36,0,10,-7,F#/G♭ Minor,4,0cMyMeOTBeweBZRfP6MJ6e,USUG12002754,no
21,"Gimme Shelter (feat. Lzzy Hale)","Stone Sour,Lzzy Hale",120,12A,86,2025-10-21,04:26,51,"post-grunge, alternative metal, nu metal, ","Straight Outta Burbank",2015-12-11,60,1,0,64,0,10,-6,C♯/D♭ Minor,4,3WeEYZivpdmeyXupUpQxgV,NLA321500221,no
22,"End of Beginning","AMH",160,10B,44,2026-05-11,02:31,62,"","End of Beginning",2026-05-04,60,49,0,44,0,30,-6,D Major,4,7fil4W4wMI3t4YOQMHu9dV,QZZ772676985,no
23,"Nothing Compares 2 U","Chris Cornell",65,3B,56,2026-05-20,04:12,55,"grunge","No One Sings Like You Anymore",2020-12-11,49,12,0,40,0,0,-6,C♯/D♭ Major,4,65mnqRK6fcQWpgNV2UibqM,USUG12003566,no
24,"Another Brick in the Wall, Pt. 1, 2, 3 - Pink Floyd Cover","Korn",103,8B,51,2026-05-20,07:07,60,"nu metal, metal, rap metal, alternative metal","Greatest Hits, Vol. 1",2004-10-05,61,0,12,8,0,0,-9,C Major,4,5fBI2YzuyOVF0nkYjIGjJv,USSM10412369,no
25,"Everybody Wants to Rule the World","Sammy Rae & The Friends",110,7B,68,2026-07-02,05:07,40,"pop soul","Everybody Wants to Rule the World",2021-05-28,39,8,0,36,10,20,-7,F Major,4,5DcOa9TZCWMeBFl3wP7pSu,CAN112100194,no